[
  {
    "id": 9001,
    "source_kind": "notice_pdf",
    "url": "https://static.applyhome.co.kr/ai/aia/getAtchmnfl.do?houseManageNo=2026000164&pblancNo=2026000164&atchmnflSeqNo=1797790&atchmnflSn=4",
    "fetched_at": "2026-10-07T00:00:00+09:00",
    "http_status": 200,
    "sha256": "57295428c20ee2c85a72a562f6546b031d942dcd99adb22e2eed72f80cac6443",
    "path": "notice/01_n.txt",
    "content_type": "text/plain; charset=utf-8",
    "text_path": "notice/01_n.txt",
    "complex_id": 1,
    "region_id": 1,
    "error_text": null,
    "image_hash": null
  },
  {
    "id": 9002,
    "source_kind": "notice_pdf",
    "url": "https://static.applyhome.co.kr/ai/aia/getAtchmnfl.do?houseManageNo=2026910203&pblancNo=2026910203&atchmnflSeqNo=1937047&atchmnflSn=2",
    "fetched_at": "2026-10-07T00:00:00+09:00",
    "http_status": 200,
    "sha256": "e6699e6d61a6e82cb4affcab06f927f09b183b2585a6b9a4a400ebfe0f3b9a4b",
    "path": "notice/01_m1.txt",
    "content_type": "text/plain; charset=utf-8",
    "text_path": "notice/01_m1.txt",
    "complex_id": 1,
    "region_id": 1,
    "error_text": null,
    "image_hash": null
  },
  {
    "id": 9003,
    "source_kind": "notice_pdf",
    "url": "https://xn--2i0bq5hvjp1kpzchxro8a528e.kr/gran/data/gongo01_mu2.pdf",
    "fetched_at": "2026-10-07T00:00:00+09:00",
    "http_status": 200,
    "sha256": "87aef3cebee5da8d94fd7092aed1a6fe9d31164afefc032181a863937c79bd7d",
    "path": "notice/01_m2.txt",
    "content_type": "text/plain; charset=utf-8",
    "text_path": "notice/01_m2.txt",
    "complex_id": 1,
    "region_id": 1,
    "error_text": null,
    "image_hash": null
  },
  {
    "id": 9004,
    "source_kind": "applyhome_detail",
    "url": "https://www.applyhome.co.kr/ai/aia/selectAPTLttotPblancDetail.do?houseManageNo=2026000164&pblancNo=2026000164",
    "fetched_at": "2026-10-07T00:00:00+09:00",
    "http_status": 200,
    "sha256": "6690d2ac6c2f04d83477c0306d1d99937b7d0220a23513ca5d7c86842aab0d7f",
    "path": "applyhome_detail/01_ah.txt",
    "content_type": "text/plain; charset=utf-8",
    "text_path": "applyhome_detail/01_ah.txt",
    "complex_id": 1,
    "region_id": 1,
    "error_text": null,
    "image_hash": null
  },
  {
    "id": 9005,
    "source_kind": "news",
    "url": "https://www.incheonilbo.com/news/articleView.html?idxno=1328945",
    "fetched_at": "2026-10-07T00:00:00+09:00",
    "http_status": 200,
    "sha256": "37e56175a321df922ef0ef3ae6a5d3fd707094e6c184a61dedb56e09e5476201",
    "path": "news/01_p1.txt",
    "content_type": "text/plain; charset=utf-8",
    "text_path": "news/01_p1.txt",
    "complex_id": 1,
    "region_id": 1,
    "error_text": null,
    "image_hash": null
  },
  {
    "id": 9006,
    "source_kind": "notice_pdf",
    "url": "https://static.applyhome.co.kr/ai/aia/getAtchmnfl.do?houseManageNo=2025000302&pblancNo=2025000302&atchmnflSeqNo=1554198&atchmnflSn=13",
    "fetched_at": "2026-10-07T00:00:00+09:00",
    "http_status": 200,
    "sha256": "b9b28e3eea5a8e174456f000aa910d926ba620485233f477137ca53aea93f2fd",
    "path": "notice/02_n.txt",
    "content_type": "text/plain; charset=utf-8",
    "text_path": "notice/02_n.txt",
    "complex_id": 2,
    "region_id": 1,
    "error_text": null,
    "image_hash": null
  },
  {
    "id": 9007,
    "source_kind": "notice_pdf",
    "url": "https://static.applyhome.co.kr/ai/aia/getAtchmnfl.do?houseManageNo=2026940173&pblancNo=2026940173&atchmnflSeqNo=1951097&atchmnflSn=6",
    "fetched_at": "2026-10-07T00:00:00+09:00",
    "http_status": 200,
    "sha256": "ac3efbfbadfcae8a0c0ced22549e10ea06dda6f5ef1017302eb7daeec2d20930",
    "path": "notice/02_r3.txt",
    "content_type": "text/plain; charset=utf-8",
    "text_path": "notice/02_r3.txt",
    "complex_id": 2,
    "region_id": 1,
    "error_text": null,
    "image_hash": null
  },
  {
    "id": 9008,
    "source_kind": "applyhome_detail",
    "url": "https://www.applyhome.co.kr/ai/aia/selectAPTLttotPblancDetail.do?houseManageNo=2025000302&pblancNo=2025000302",
    "fetched_at": "2026-10-07T00:00:00+09:00",
    "http_status": 200,
    "sha256": "6788cd3812403b749ce989e01e1415845c5bcb7ff06d0aabecd37ce23bb84483",
    "path": "applyhome_detail/02_ah.txt",
    "content_type": "text/plain; charset=utf-8",
    "text_path": "applyhome_detail/02_ah.txt",
    "complex_id": 2,
    "region_id": 1,
    "error_text": null,
    "image_hash": null
  },
  {
    "id": 9009,
    "source_kind": "official_site",
    "url": "https://xn--c79an5jqrb8zf6rcfy4a5qw65b.com/",
    "fetched_at": "2026-10-07T00:00:00+09:00",
    "http_status": 200,
    "sha256": "a7e85f71929e922dd9105d73616a213945d2094553d6512f843efb1057b145e0",
    "path": "official_site/02_site.txt",
    "content_type": "text/plain; charset=utf-8",
    "text_path": "official_site/02_site.txt",
    "complex_id": 2,
    "region_id": 1,
    "error_text": null,
    "image_hash": null
  },
  {
    "id": 9010,
    "source_kind": "news",
    "url": "https://www.wowtv.co.kr/NewsCenter/News/Read?articleId=A202607200201",
    "fetched_at": "2026-10-07T00:00:00+09:00",
    "http_status": 200,
    "sha256": "72c2648e6e18a1427e46890c4a5efd226afed854b8b2bc1f8997d2ad415d7359",
    "path": "news/02_p1.txt",
    "content_type": "text/plain; charset=utf-8",
    "text_path": "news/02_p1.txt",
    "complex_id": 2,
    "region_id": 1,
    "error_text": null,
    "image_hash": null
  },
  {
    "id": 9011,
    "source_kind": "notice_pdf",
    "url": "https://sd.hndapt.co.kr/pdf/송도%20한내들%20센트럴리버_입주자모집공고_전문.pdf",
    "fetched_at": "2026-10-07T00:00:00+09:00",
    "http_status": 200,
    "sha256": "30d016020a25d25d763a7039eb2207cc2f33d3679b969e1ca2dad360f70c31b8",
    "path": "notice/03_n.txt",
    "content_type": "text/plain; charset=utf-8",
    "text_path": "notice/03_n.txt",
    "complex_id": 3,
    "region_id": 1,
    "error_text": null,
    "image_hash": null
  },
  {
    "id": 9012,
    "source_kind": "notice_pdf",
    "url": "https://static.applyhome.co.kr/ai/aia/getAtchmnfl.do?houseManageNo=2026940088&pblancNo=2026940088&atchmnflSeqNo=1797241&atchmnflSn=4",
    "fetched_at": "2026-10-07T00:00:00+09:00",
    "http_status": 200,
    "sha256": "d7cd9957fc802cdc1381b8fbf96f0993a29c24138bea014f9814374877b1aef8",
    "path": "notice/03_r.txt",
    "content_type": "text/plain; charset=utf-8",
    "text_path": "notice/03_r.txt",
    "complex_id": 3,
    "region_id": 1,
    "error_text": null,
    "image_hash": null
  },
  {
    "id": 9013,
    "source_kind": "applyhome_detail",
    "url": "https://www.applyhome.co.kr/ai/aia/selectAPTLttotPblancDetail.do?houseManageNo=2025000582&pblancNo=2025000582",
    "fetched_at": "2026-10-07T00:00:00+09:00",
    "http_status": 200,
    "sha256": "edf310a70b2e5e99f0222ee2a6d5f41badc22f23b817bbaef4d2f07a758247e6",
    "path": "applyhome_detail/03_ah.txt",
    "content_type": "text/plain; charset=utf-8",
    "text_path": "applyhome_detail/03_ah.txt",
    "complex_id": 3,
    "region_id": 1,
    "error_text": null,
    "image_hash": null
  },
  {
    "id": 9014,
    "source_kind": "official_site",
    "url": "https://sd.hndapt.co.kr/",
    "fetched_at": "2026-10-07T00:00:00+09:00",
    "http_status": 200,
    "sha256": "060f5bd392f4e86b42293ae92c05d66eba706a7635c5e8181eed978600048091",
    "path": "official_site/03_site.txt",
    "content_type": "text/plain; charset=utf-8",
    "text_path": "official_site/03_site.txt",
    "complex_id": 3,
    "region_id": 1,
    "error_text": null,
    "image_hash": null
  },
  {
    "id": 9015,
    "source_kind": "notice_pdf",
    "url": "https://static.applyhome.co.kr/ai/aia/getAtchmnfl.do?houseManageNo=2025000222&pblancNo=2025000222&atchmnflSeqNo=1553383&atchmnflSn=2",
    "fetched_at": "2026-10-07T00:00:00+09:00",
    "http_status": 200,
    "sha256": "b62514e80f24cc7e0888774ef0a44176adb3b3d208762b06707df4bb65cd6d07",
    "path": "notice/04_n.txt",
    "content_type": "text/plain; charset=utf-8",
    "text_path": "notice/04_n.txt",
    "complex_id": 4,
    "region_id": 1,
    "error_text": null,
    "image_hash": null
  },
  {
    "id": 9016,
    "source_kind": "notice_pdf",
    "url": "https://static.applyhome.co.kr/ai/aia/getAtchmnfl.do?houseManageNo=2025910122&pblancNo=2025910122&atchmnflSeqNo=1561312&atchmnflSn=4",
    "fetched_at": "2026-10-07T00:00:00+09:00",
    "http_status": 200,
    "sha256": "ca5dcffac0d9d1090e58edd875b2d320ba972cc60ba245076874bf4d74d133df",
    "path": "notice/04_m.txt",
    "content_type": "text/plain; charset=utf-8",
    "text_path": "notice/04_m.txt",
    "complex_id": 4,
    "region_id": 1,
    "error_text": null,
    "image_hash": null
  },
  {
    "id": 9017,
    "source_kind": "notice_pdf",
    "url": "https://static.applyhome.co.kr/ai/aia/getAtchmnfl.do?houseManageNo=2025000435&pblancNo=2025000435&atchmnflSeqNo=1582277&atchmnflSn=5",
    "fetched_at": "2026-10-07T00:00:00+09:00",
    "http_status": 200,
    "sha256": "d5cf31d71545473593b4ab021d7f7232fb4dce9dc87af3e7cdd19e8e252b1844",
    "path": "notice/05_n.txt",
    "content_type": "text/plain; charset=utf-8",
    "text_path": "notice/05_n.txt",
    "complex_id": 5,
    "region_id": 1,
    "error_text": null,
    "image_hash": null
  },
  {
    "id": 9018,
    "source_kind": "notice_pdf",
    "url": "https://static.applyhome.co.kr/ai/aia/getAtchmnfl.do?houseManageNo=2026940078&pblancNo=2026940078&atchmnflSeqNo=1789033&atchmnflSn=3",
    "fetched_at": "2026-10-07T00:00:00+09:00",
    "http_status": 200,
    "sha256": "6a0de6435e52f33ce942de9c42ef7a0bd8f1f5ef1a5a75038520fc3149ee499d",
    "path": "notice/05_r.txt",
    "content_type": "text/plain; charset=utf-8",
    "text_path": "notice/05_r.txt",
    "complex_id": 5,
    "region_id": 1,
    "error_text": null,
    "image_hash": null
  },
  {
    "id": 9019,
    "source_kind": "applyhome_detail",
    "url": "https://www.applyhome.co.kr/ai/aia/selectAPTCompetitionPopup.do?houseManageNo=2025000435&pblancNo=2025000435",
    "fetched_at": "2026-10-07T00:00:00+09:00",
    "http_status": 200,